Subject Area,Emerging Keywords
"MEDI,MATE,ENGI","Acute kidney injury,Clot circuit,CRRT,Heparin,Regional citrate anticoagulation; Bone healing,calvarium,chemokine (c-c motif) ligand 2,fibroblast growth factor 18,M2 macrophage"
"MEDI,MATH,SOCI","communication technology,COVID-19,human factors,Personal protective equipment,simulation,verbal communication"
"MEDI,PHAR","22-(4′-py)-JA,angiogenesis,invasion,metastasis,non-small-cell lung cancer; A. paniculata (Burm.f.) nees (acanthaceae),adverse effects,canine diabetes,inflammation,oxidative stress; Aegle marmelos fruit,BV2 microglia,Moringa oleifera,Neuroinflammation,Reactive oxygen species (ROS); Analgesic,anesthesia,intravenous infusion,nefopam,postoperative pain; Antioxidant property,Cannabis sativa L.,Genetic relationship,ISSR marker,Phytoconstituent; Asia,children living with HIV,lipid and glucose abnormalities; Diagnostics,lab-on-chip,microfluidic,point-of-care,Saliva; Mechanisms,MSC-EVs,Neurodegenerative diseases,Therapeutic strategies; advanced glycation end products inhibition,antidiabetic,Dendrobium orchids,phytochemical,α-amylase,α-glucosidase; antibiotic combinations,high-content analysis,phenotypic heterogeneity,single-cell profiling; deferasirox (DFX),meta-analysis,pharmacodynamics,pharmacogenomics (PGx),pharmacokinetics,systematic reviews; epidemiology,hematologic malignancy,invasive fungal infections,Thailand,treatment outcomes; health policy,pharmacist,pharmacy practice,public health,traditional and complementary medicines"
"MEDI,PHAR,CHEM","boron-doped diamond thin film electrode,drug formulations,flow injection analysis,Methimazole"
"MEDI,PHAR,ECON","biologic disease-modifying antirheumatic drugs,cost-effectiveness analysis,cost-utility analysis,economic evaluation,psoriatic arthritis"
"MEDI,PHYS,BIOC","Cone-beam computed tomography,Dental radiography,Dentistry,Radiation protection"
"MEDI,PSYC","ABC theory,cognitive behavioral therapy,mindfulness,obligatory exercise,sports reinjury; Affective disorders,Chronic fatigue syndrome,Inflammation,Major depression,Oxidative stress,Psychiatry; Anxiety,Inflammation,Kynurenine,Mood disorders,Neuro-immune,Tryptophan; COH-FIT,Covid-19,Pandemic,Survey: P-factor: well-being: mental health: psychiatry: psychometric; COVID-19,Health Behaviors,PPE use,Psychological Flexibility,Social Distancing; attention-deficit/hyperactivity disorder,congenital heart disease,electrocardiogram,stimulant medication"
"MEDI,PSYC,BIOC","cognitive aging,disfluencies,sequential corpus analysis,speech,speech production"
"MEDI,PSYC,HEAL","Abuse detection,Child abuse,Emotional abuse,Physical abuse,Self-figure drawing,Sexual abuse"
"MEDI,PSYC,SOCI","COVID-19,Living alone,Older adults,Social care,Social support,Thailand; adolescents,Asia,children,disclosure,HIV; birth outcomes,HIV,perinatal,pregnancy,women,youth; gender diversity,LGBT,medical education,medical student,sex,sexual activity"
"MEDI,SOCI","Elder abuse,life satisfaction,older adults,stress-buffering"
"MEDI,SOCI,ARTS,COMP,ENGI,DECI","Binary Classification,CNN,Diabetic Retinopathy,InceptionV3,MobileNet,Transfer Learning,VGG16; CODESYS,GALILEO,In-class Tool,PID,PLC; EMS,Energy Monitoring Systems,Industry 3.0,Industry 4.0,MQTT,SCADA; digital microscope camera,efficientdet,faster-rcnn,microalgae detection,retinanet,smartphone camera,yolov5"
"MULT,ENGI","Bangkok,raw water,Salinity intrusion,wastewater reuse,wastewater treatment"
NEUR,"affective disorders,cytokines,inflammation,major depression,neuro-immune,psychiatry; aging,Alzheimer's disease,DNA sequence,epigenetics,immune,non-coding RNA,oligonucleotides,telomere-associated; biomarkers,inflammation,major depression,mood disorders,neuro-immune; central tendency,cognitive assessment,degeneracy,evolution,idiographic,neurodiversity,neuropsychological assessment,normative data,premorbid function,psychometrics; chronic fatigue syndrome,cytokines,depression,mood disorders,neuroimmune,neuroinflammation; classification,deep learning,disease,machine learning,neuroscience; major depression,mood disorders,neuroimmune,oxidative stress,precision medicine models,psychiatry"
"NEUR,AGRI,BIOC","3C-like protease,Homology modeling,Molecular docking,Molecular dynamics simulation,Yellow head virus; Aeromonas hydrophila,Antimicrobial resistance,Colistin,Hybrid red tilapia,Salmonella,Vibrio cholerae; African swine fever (ASF),Carcasses and products,Diffusion model,Network analysis,Pig,Thailand; COVID-19,In-silico,Main protease,Quercetin,SARS-CoV-2; Gene expression,NanoString nCounter,Subtype,Triple-negative breast cancer"
"NEUR,AGRI,IMMU,BIOC","Cyanobacteria,HPLC,Nitrogen deprivation,PHB,Poly(3-hydroxybutyrate),Synechocystis"
"NEUR,BIOC","Creutzfeldt-Jakob disease,diagnostic biomarker,low- and middle-income countries,prion disease surveillance,real-time quaking-induced conversion assay; affective symptoms,chronic fatigue syndrome,indoleamine-2,3-dioxygenase,inflammation,neuro-immune,neurotoxicity"
"NEUR,IMMU","Affective disorders,Antioxidants,Autoimmunity,Depression,Neuro-immune,Oxidative and nitrosative stress"
"NEUR,MEDI,BIOC","Antioxidants,Inflammation,Neuroimmune,Oxidative stress,Physiological stress; Craniovertebral junction instability,Hypoglossal canal,Jugular foramen,Neurovascular injury,Occipital condyle"
"NEUR,MEDI,NURS","Glossopharyngeal neuralgia,Hemifacial spasm,Neurovascular compression syndromes,Type-writer tinnitus,Vestibular paroxysmia"
"NEUR,MEDI,PHAR","Clozapine,Compensatory Immune Response System,Cytokines,Inflammatory Response System,Meta-analysis,Psychotic disorders"
"NEUR,MEDI,PHAR,BIOC","Depression,Mood disorders,Neuro-immune,Oxidative stress,Psychiatry"
"NEUR,MEDI,PSYC","anticonvulsants,migraine disorders (MeSH term),migraine with aura,preventive medication,quality of life"
"NEUR,PHAR","bacterial translocation,Chronic fatigue syndrome,inflammation,myalgic encephalomyelitis,neuro-immune,oxidative stress; biomarkers,inflammation,Myalgic Encephalomyelitis/chronic fatigue syndrome,neuro-immune,oxida-tive stress,physiological stress"
"NEUR,PHAR,BIOC","Corticosteroid,Histological feature,Hyaluronic acid,Knee osteoarthritis,Triamcinolone acetonide; angiogenesis,capillary vascularity,diabetic wound,neutrophils,Phyllanthus emblica Linn,simvastatin,wound closure; anticancer,antioxidant,breast cancer,combination,Phellinus linteus,Smilax corbularia Kunth"
"NEUR,PSYC","Anxiety-like behavior,Chronic mild stress,Depressive-like behavior,Estrogen,GABAergic system; Biological preparedness,Clinical conceptualization,Nosology,Phobia,Research Domain Criteria initiative (RdoC),Therapy"
"NEUR,PSYC,BIOC","cardiovascular reactivity,defensive,heart rate variability,methodology,orienting"
"NEUR,PSYC,SOCI,ARTS","Amodal,Audition,Individual differences,Object recognition,Vision; embeddings,Morphological processing,pseudo-suffixed words,spoken word recognition,stem priming"
NURS,"ASEAN,life expectancy,nurse density,nursing workforce,under-five mortality; COVID-19,health policy,healthcare workers,humans,indonesia,sustainable development,vaccines; Cambodia,Competency,Development,Nursing process,Psychometric testing; Clinical Areas,compassion satisfaction,health care providers,nursing practice,palliative care,self-care,spirituality,transcultural research; Concept formation,Culture,Goals,Personal recovery,Schizophrenia,Scoping review; Health check,Mental health,Nurse,Psychosis,RCT,Weight; Measurement errors,Pressure injury,Repositioning,Scoping review; access,barriers,depression,facilitators,Indonesia,mental health services,social support,stigma; activities of daily living,ADL limitation,disability,National Health Examination Survey,older adults,physical activity; adolescence,anorexia nervosa,bulimia nervosa,children,eating disorders,feeding and eating disorders,nursing,Thailand; anxiety,depression,physical activity,stress,systemic immune-inflammation index,type 2 diabetes mellitus; blood pressure,ischemic stroke,multimodal intervention,nurses,Thailand; body dissatisfaction,body image,coronary artery bypass graft,factor analysis,Thailand; ethics,hermeneutic,hospitals,Indonesia,leadership,nurse administrators,team leader; family support ‌,health-related quality of life,self-management,systematic review,type 2 diabetes; mental disorders,mental health services,nurses,quality of life,recovery,schizophrenia; mental health issues,privacy,psychiatric nursing,public sector,stereotyping,stigmatization"
"NURS,AGRI","2K1C rat,Garcinia dulcis,gut microbiota,hypertension,metabolites; COVID-19 pandemic,health-promoting behaviors,NCDs,nutrition,older adults; Camellia sinensis,cardiovascular disease,catechin,diabetes,EGCG,metabolic syndrome,natural products,obesity,therapeutic mechanisms; Cannabis-infused food,Consumer behavior,Enjoyment,Necessary conditions,Necessity logic,Young adult; Cholangiocarcinoma,kaempferol,necroptosis,quercetin,Smac mimetics; Health halo,Healthy choice,Nutrient-content claim,Sugar label,Warning label; antimotility medication,antisecretory medication,dietary management,high stool output,intestinal failure,short bowel syndrome; arterial stiffness,carotid-femoral pulse wave velocity,chronic hemodialysis,menaquinone-7; attention deficit hyperactivity disorder,autism spectrum condition,autism spectrum disorder,brain function,choline,neurodevelopment,neurotransmitters,pregnancy,specific learning disorders; chitosan oligosaccharide,chronic kidney disease,gut leakage,gut microbiota,maltodextrin,prebiotics,tight junction; colitis-associated colorectal cancer,defatted rice bran,fiber-degrading bacteria,goblet cell loss,gut microbiota,health,health product,mucus layer thickness,short-chain fatty acid (SCFA)-producing bacteria,short-chain fatty acids (SCFAs); eating disorders,gender,LGBTQ+,weight status; fructose,glucose,Lactiplantibacillus plantarum,obesity,prediabetes; gut microbiota,overweight and obesity,prebiotic,probiotic,synbiotic"
"NURS,MEDI","Acute kidney injury,Endothelial dysfunction,Inflammation,Microcirculation,Pathophysiology,Sepsis,Tubular injury; Africa,digital health,evidence-based practice,health data,health policy; Biomarkers,Delirium,Inflammation,Neuro-immune,Polyreactive antibodies,Psychiatry; COVID-19 pandemic,Customer experience,service improvement,tracking system,waiting time; COVID-19,Epidemiology,Home parenteral nutrition,Intestinal failure,Pandemic,SARS-CoV-2; Care gaps,Intestinal failure,Literature review; Chronic kidney disease,Cost-effectiveness analysis,Ketoanalogue supplementation,Low-protein diet,Taiwan and Thailand; Critical care,Critical illness,ICU,Micronutrients,Trace elements,Vitamins; adiposity,body composition,breastfeeding,complementary feeding,deuterium,fat mass,lean mass,obesity; attitude,female students,knowledge,menstrual hygiene management,practice; breastfeeding,distal sensory polyneuropathy,National Health and Nutrition Examination Survey,peripheral neuropathy; caregiving,home care,paid caregiver,population aging,qualitative methods; gradient-free proportional topology optimization,isogeometric analysis,multiresolution,reconstruction with NURBS basis functions; home nutrition support,intestinal failure,patient care team,survey"
"NURS,MEDI,AGRI","allergy,asthma,atopic dermatitis,atopic disease,cow's milk protein allergy,infant formula,rhinitis"
"NURS,MEDI,AGRI,BIOC","C. elegans,hyperglycemia,lipid metabolism,Oxidative stress,Seladin-1"
"NURS,MEDI,HEAL","Disabilities,HIIT,Interval exercise,Public health,Young people; Fall risk,geriatrics,measurement,mobile app,test; advanced lung cancer,chemotherapy,clinical prediction rule,decision making,limited resources; ageing,caregiving,Community-Integrated Intermediary Care (CIIC),older adult,Thailand; community pharmacy services,international cooperation,pharmacists,reproductive health,sexual health,survey"
"NURS,MEDI,SOCI","Bullying,Psychologically unsafe,School,Student,University; Delta strain,Indonesia,Omicron strain,Post-COVID-19 symptoms,Vaccination efficacy; Health services,Nursing care delivery,Nursing services,Quality of nursing care"
"NURS,SOCI","Clinical competence,Cultural competence,Nursing education,Randomized controlled crossover trial,Virtual simulation; Developing countries,retirement saving,retirement savings adequacy,tax incentives; old-age allowance,older persons,preference,Social pension,targeted,Thailand,universal"
"PHAR,AGRI,BIOC","cheminformatics,DNA repair,machine learning,PARP-1,QSAR,webserver"
"PHAR,AGRI,ENVI,BIOC","Anti-angiogenesis,Anti-inflammation,Antioxidant,Sesame,Sesamin,Toxicity,Zebrafish"
"PHAR,BIOC","Albizia lebbeck(L.) Benth,apoptosis,ER stress,glutamate,microglial cells,neuroprotection,neurotoxicity; Angiogenesis,Calmodulin-regulated spectrin-associated protein 3 (CAMSAP3),Hypoxia-inducible factor-1α (HIF-1α),Invasion,Lung cancer,Nucleolin (NCL); COVID-19,COVID-19 therapeutics,global pandemic,SARS-CoV-2,senolytic drugs; Cardiac function,Mitochondrial quality,Mitral regurgitation,Nitric oxide,sGC stimulator,Vericiguat; Diabetes mellitus,glycosylation,hepatocellular carcinoma,hyperglycemia,O-GlcNacylation; aging,Box A,DNA damage,regenerative medicine,stemness; apoptosis,DH_22,lung cancer,Renieramycin T derivative; cholecalciferol,Colorectal cancer,interleukin-10,PBMC,regulatory T-cells,TGF-β1; developmental endothelial locus-1,macrolides,osteoblastogenesis,periodontitis,Porphyromonas gingivalis lipopolysaccharide"
"PHAR,ENVI","Assay,Digital image colorimetry,Ethambutol,Green chemistry,Smartphone"
"PHAR,HEAL","Expert system,Hypertension,Medication adherence,Patient education"
"PHAR,IMMU,BIOC","COVID-19 vaccines,heterologous booster,inactivated,NVX-CoV2373,protein-based,viral vector; Nigella sativa L,Platelet-derived growth factor,Vascular endothelial growth factor,Wound healing; and dynamic simulation,anti-Acanthamoeba activity,encystation,molecular docking,pinocembrin,Propolis extract"
"PHAR,MEDI,BIOC","Cdk5/p35/p25 signaling pathway,Glutamate,Neuronal apoptosis,Soybean polysaccharides with chitosan,Stigmasterol; fingerroot extract,Panduratin A,Pharmacokinetics,Zingiberaceae"
"PHAR,MEDI,HEAL","anticancer activity,hepatocellular carcinoma,HepG2 cells,Triphala,tumor"
"PHAR,MEDI,IMMU,BIOC","activated charcoal,ceftriaxone,gut microbiota; area under the concentration curve,critically ill patients,pharmacokinetics,therapeutic drug monitoring,vancomycin; penicillin resistance,penicillin-binding proteins,Streptococcus suis,β-lactams resistance"
"PHYS,CHEM,BIOC,ENGI,COMP","HEVC,learning-based rate control,PSO; NB-IoT technology,passive RFID tag,RFID,specimen transport box,specimen tube; asset management,BIM,circular economy,climate change adaptation,digital twin,life cycle,materials stock flow,railway maintenance,resilience,sustainability; automation,collaborative robots,digital twin,Industry 4.0,painting,serial mechanisms,spray gun; beamforming,cell-free,cooperative communication,low-complexity,metasurface,particle swarm optimization,reconfigurable intelligent surface; blockchain technology,intelligent transportation system,internet of vehicles,license plate recognition,privacy in ITS; co-located radar,direction of arrival estimation,flower pollination algorithm,MIMO systems; convolutional neural networks,convolutional Transformer encoder,multi-head attention,spatial features,speech emotion recognition,temporal features; deep learning model,lung cancer,non-small cell lung cancer (NSCLC),sooty tern optimization algorithm (STOA); dihydropyridine,fluorescence quenching,fluorescent sensor,gold nanoparticles (AuNPs),gold(iii) ion detection; intrusion detection system,network security,network visibility,port scanning,vulnerability assessment; object classification,pincer grasping,pneumatic gripper,sensible grasping,soft gripper,stiffness sensing"
"PHYS,CHEM,MATE,BIOC,ENGI","Chitosan,Malachite green,Nanocomposite,Paddy straw,Rhodamine B,UV irradiation"
"PHYS,CHEM,MATH,COMP","carry-over effect,chaos control,delayed food chain model,fear effect,Hopf bifurcation"
"PHYS,CHEM,MULT,BIOC,COMP","COVID-19,CRISPR/Cas12a,Isothermal amplification,Lyophilization,SARS-CoV-2"
"PHYS,EART","Galaxies: evolution,Galaxies: high-redshift,Galaxies: photometry,Galaxies: star formation,Submillimeter: galaxies; Instrumentation: adaptive optics,Instrumentation: high angular resolution,Methods: analytical,Methods: numerical,Techniques: high angular resolution"
"PHYS,EART,SOCI","BERT,Geocoding,Geospatial,Topology words,Toponym extraction; CHCNAV,Geodetic,GNSS,Quality Assessment,Surveying; Congestion,Delay,GPS,Queue Length,Traffic Management; GNSS Triangulation Network Characterisation,Horizontal Positioning Accuracy,Hypothesis Test NRTK-VRS GNSS CORS"
"PHYS,ENER","Bandwidth function,Diffusion kinetics,High pressure,Mg-B-H,Spectral function,Superconductivity; Biohydrogen,Clostridium felsineum strain CUEA03,Hydrogen fermentation; CO2 utilisation,CO2-Steam gasification,Hydrogen,Two-stage gasification,Wood pellets; Catalyst,Decomposition of formic acid,DFT,Hydrogen energy,N-doped graphene; Dry methane reforming,Proton conductor,Solid oxide electrolysis cell,Syngas production; Electrodeposition,First-principles calculations,Hydrogen evolution reaction,Ni–Cu–C electrocatalysts; Electrolysis,Hydrogen,Hydrogen evolution reaction,Phosphidization,Urea oxidation; First-principles,Hydrogen diffusion,Hydrogen-vacancy diffusion,Magnesium-based hydrides; LiBr absorption chiller,Optimization,Proton conducting solid oxide fuel cell,Response surface methodology,Trigeneration; atmospheric dispersion,meteorological data selection,Radiation consequence evaluation"
"PHYS,ENGI","Amperometry,biosensing,biosensor,disease biomarker,dysbiosis,enzyme allostery,reductase; Artificial neural network,Heat exchanger,Nanofluids,Properties; Artificial vision,Human eye,Object detection,Sonar glass,Synchronization protocol,Vision based sensors"
"PHYS,MATE","Adsorption energy,Adsorption of small gases,C24N24 nanocage,CNNC,DFT method,gas storage material,NO sensor; Aging effect,Aqueous electrolyte,Coin cell,Cycling stability,Metal oxide; Antibacterial activity,Nanocarrier,SiO2@C core–shell,Slow release,Thymol; Applied plasma science,IAPS,ISAPS 2022,New trend; annealing,facing targets sputtering,Fe3Si film,mechanical property,wettability; boron particles,corrosion,nanocomposite coatings,Ni-W coatings; boron-deficient tantalum diboride,first-principles cluster expansion,mechanical properties,thermodynamic stability,transition-metal diborides; degradation,heterojunction,nickel oxide,photocatalyst,titanium dioxide"
"PHYS,MATE,CHEM","3D printing,Nanocomposite,Nanomaterial,Polymer; A1. Nanostructures,A3. Molecular beam epitaxy,B2. Semiconducting III-V materials; Active packaging,Antibacterial activities,Antiviral activity,Green synthesis,Silver nanoparticles; Alumina,Antimicrobial surfaces,Copper,Corrosion resistance,PEO coatings,Porous films; Anode,Double transition metal MXene,Lithium-ion batteries (LIBs),Ti2NbC2Tx,Ti3C2Tx; CO poisoning,first-principles,Heterogeneous electron distribution,high-entropy materials,pre-water-gas shift reaction; CO2 adsorption,Nitrogen,Polybenzoxazine,Porous carbon,Silica templating; Charge transfer,DFT,Film,Photocatalyst,Substrate; ENR,HDPE,PBAT,PLA,Polymer blending"
"PHYS,MATE,ENGI","Chemical recycling,Diacids,HDPE,Oxidative degradation,UV-curable acrylate copolymers; Computational wear prediction,Fatigue,Impact wear,Wear mechanism,Wear rate; analog quantum simulators,driven quantum many-body systems,quantum supremacy,random matrix ensembles,sampling quantum advantage,thermalization"
"PHYS,MATH","Basic random walk property,Comb structure,Continuous-time random walk,First passage property,Quasi-1d lattice; functional saddle points,graph Laplacians,random graphs,statistical field theory,supersymmetry"
"PHYS,MATH,CHEM,MATE,BIOC","analytical formula,CEV model,conditional moments,Heston model,Heston-CEV hybrid model"
"PHYS,MATH,COMP","Drop-out Layer,Load forecast,LSTM,Neural Network; Food Industry,IoT,Teleoperating,Web Application; LMI approach,nonlinear observer,pneumatic system,soft gripper,unknown input estimation; antenna delay,localization,simultaneous ranging,two-way ranging,ultra-wideband; biometric authentication,individual typing-skill,keystroke dynamics,mobile touchscreen,multi-biometrics; bisection,depth camera,food portioning,point could,python; depth camera,mechatronics,point cloud,robotics,slicing food; extended state observer,gait cycle tracking,human torque estimation,integral sliding mode control,rehabilitation robot; fuse objective functions,image super-resolution,MS-SSIM objective function,progressive upsampling framework,residual-in-residual dense block"
"PHYS,MATH,MATE,ENER,COMP","Energy performance indicators,LED luminaire selection,Road lighting,Road lighting design"
"PHYS,MEDI","detection,dielectric,gas sensor,hydrogen,hydrogen economy,metal alloy,sensors,waveguide; donut modes,free-space optics (FSO),mode-division multiplexing (MDM),optical code division multiple access (OCDMA)"
PSYC,"Actual SES,Age,Aggression,Death anxiety,Life satisfaction,Perceived SES,Sex; Body appreciation,Body appreciation Scale-2 (BAS-2),Cross-cultural,Measurement invariance,Multi-group confirmatory factor analysis (MG-CFA),Psychometrics,Structural analysis; COVID-19,experience-sampling,interdisciplinary,well-being,worldwide; COVID-19,financial strain,loneliness,relationship conflict,relationship quality,stress and coping; Creative self-efficacy,innovative behavior,medical education,psychological empowerment,transformative leadership; Culture,Measurement development,Thailand,Time Perspective,Zimbardo Time Perspective Inventory; HIV,internalized HIV-related stigma,people living with HIV,scale development,stigma,Thailand; Inflammation,Neuro-immune,Oxidative stress,Perinatal depression,Premenstrual syndrome; adult,COVID-19 stress,frontline health worker,satisfaction with life,transmission of misinformation; anomie,economic inequality,moral circles,moral expansiveness,trust; child sexual abuse,depersonalization,derealization,dissociation,incest; cross-culture,economic inequality,social class,stereotyping"
"PSYC,ARTS","Cross-temporal meta-analysis,Non-verbal intelligence,Standard progressive matrices,The sample-size weighted-regression equation; implausible events,misinterpretations,noncanonical structures,nonce words,sentence processing"
"PSYC,BUSI","Choice confidence,Patronage intention,Perceived benefits,Prioritization,Servicescape,Travel application,Uncertainty reduction theory,URT"
"PSYC,SOCI","Acceptance and Commitment Group Therapy,Fears of negative evaluation,Psychological flexibility,Social anxiety,Thai; Culture,Ecological psychology,Economic development,Positive psychology,Situational assessment,Socioeconomic status,Subjective well-being"
"PSYC,SOCI,ARTS","culture,facebook,information,online prosocial behaviour,self-construal,social media,well-being; eco-cultural perspective,Israel,self-figure drawing,symbolic representations,Thailand"
"SOCI,BIOC","Androgen receptor,Autism spectrum disorder,Bisphenol A,Endocrine-disrupting chemical,Microplastics,Molecular docking,Sex difference,Synaptogenesis,Transcription factor"
"SOCI,BIOC,NEUR,PSYC,AGRI","emotional intelligence,health anxiety,interpersonal competence,menopausal women,physical exercise"
"SOCI,BUSI","Apparel supply chains,Institutional theory,Inter-organizational networks,Market pressures,Pakistan,Supplier firms; Architectural and engineering education,building information modeling,building information modeling curriculum,building information modeling education,pedagogical design; Bangkok,Creative district,Linear tourism,Multiculturalism,Urban tourism; Civic space,Civil society,COVID-19,Shrinking space,Southeast Asia; Crisis,Emotional exhaustion,Job embeddedness,Life satisfaction,Thailand,Work-from-home; Disclosure regulation,Emerging market,Information content,Mandatory disclosure,Timeliness; Thailand,Tracking violence,Violent crime,Violent crime index; augmented reality,elementary school students,precision instruction,PWIM,reading ability"
"SOCI,BUSI,ECON","aligning strategies with SDGs,ASEAN manufacturing firms,labor productivity,sustainable development goals,technical efficiency; bimodal distribution,export intensity,firm-level heterogeneity,pure exporters; health checkup,household member,living arrangement,long-term care"
"SOCI,CHEM","Administrative Issues,Aqueous Solution Chemistry,Distance Learning/Self-Instruction,First-Year Undergraduate/General,Hands-on Learning/Manipulatives,Laboratory Instruction,Microscale Lab; Analytical Chemistry,Calibration,Colorimetric Analysis,Distance Learning/Self-Instruction,Hands-On Learning/Manipulatives,Instrumental Methods,Laboratory Instruction,Second-Year Undergraduate; Buffer,First-Year Undergraduate,General Chemistry Lab,Lab@Home,Properties of Buffers"
"SOCI,COMP","Artificial intelligence–based learning,Automatic question generation,Education technology,Language learning,Multiple-choice question; e-learning,english language teaching and learning,reading comprehension,vocabulary enhancement,writing competencies; financial services,hedonic motivation,Information quality,relationship quality,social media use; intention to use,mobile technologies,secondary school students,technology acceptance model,Thailand"
"SOCI,COMP,BUSI,ECON","Deep-tech,Entrepreneurship,Innovation,Intellectual property,New product development,Research to commercialization,Technology transfer,Technopreneurship"
