Subject Area,Emerging Keywords
"ENVI,ENER,SOCI,COMP","Bangkok,deep convolutional neural networks,object detection,quality of life,semantic segmentation; Blockchain functional benefits,Blockchain usage intention,perceived security,relationship quality; GHG emissions,microplastics,recycling,resource depletion,strategy; anaerobic digestion,centralized system,composting,composting bin,environmental assessment,food waste processor,home composting,incineration,landfill,on-site system; audit,audit process,data analytics,process management,technology; bibliometric review,customer engagement,marketing strategy,ROI metrics,SME,social media; brand love,brand loyalty,ESG,generational difference,product involvement; central business district (CBD),life satisfaction,semantic segmentation process,sustainable transportation,well-being; electric vehicle,energy management system,hybrid energy storage system,lithium-ion battery,power converter,supercapacitor"
"ENVI,ENGI","anti-breast cancer activity,antioxidant,hyaluronidase,marine bacteria,Staphylococcussp; aquatic pollution,mangrove area,marine debris,microplastic,sediment core"
"ENVI,HEAL,AGRI,PHAR,DENT","Disability,EQ-5D-5L,HAQ-DI,Health-related quality of life,Psoriatic arthritis,Utility; Gingivitis,Mouth care product,Oral health status"
"ENVI,MATH,ENER,ENGI","Battery performance,Dynamic model,Electrolyte imbalance,Life cycle analysis,Vanadium redox flow battery; Biodiesel,Cyberlindnera rhodanensis CU-CV7,Grass,Oleaginous yeast"
"ENVI,PHAR","Acid mine drainage,Arsenic,Copper,Sodium phytate,Water hyacinth; Biotechnology approaches,Enzyme engineering,Microbial engineering,Microplastic,Microplastic removal,Sources of microplastics; Cannabis,Cardiovascular event,Marijuana,Meta-analysis,Myocardial infarction,Stroke,Systematic review; Carbon material,Degradation,Peroxymonosulfate,Plant and microbial,Rhodamine B,Used face masks; Daboia siamensis,next-generation sequencing,Russell’s viper,toxin genes,venom gland transcriptomes,Venomix pipeline; GNSS and GPS,Hydrology and bathymetry,Macroplastic transport hotlines,Retention and remobilisation,River estuary,Surface drifters and trackers; adaptation,Braconidae,Ichneumonidae,Melitaeinae,Papiliondae,secondary plant compounds"
"ENVI,SOCI,ARTS","air pollution control,Bangkok,car reduction policy,stated preference survey,travel demand management; cultural hybridity,design methodology,Siam,traditionalism,window design"
"ENVI,SOCI,ARTS,AGRI,EART","210Pb,Decadal time scale,Shoreline erosion,Thailand,Tropical cyclones; Holocene,Luminescence dating,Pleistocene,Sand ridges,Sea-level change,Sundaland,Thai-Malay peninsula"
"ENVI,SOCI,BUSI","agency theory,carbon emissions,classified boards,corporate governance,ESG,staggered boards; agency theory,carbon emissions,climate change,corporate governance,takeover market; asset redeployability,board gender diversity,corporate governance,female directors,redeployable assets,sustainability; attitude–behavior gap,business strategies,business sustainability transition,sustainable business model,sustainable food business,sustainable food systems; attitude–behavior gap,environmental knowledge,green consumer behavior,green value,moderating effect; board of directors,corporate financial decisions and outcomes,corporate governance,military,political connections,risk and return,sustainability; board of directors,corporate innovation,gender diversity,resource dependence theory,risk preference,upper echelons theory; business strategy,coffee supply chain,domestic markets,farmer–NGO collaboration,human ecology,sustainability challenges; classified board,corporate governance,corporate social responsibility,social capital,social commitment,staggered board,sustainability; co-opted boards,corporate governance,ESG,managerial myopia hypothesis,stakeholder and good management hypothesis; corporate governance,corporate social responsibility,mergers and acquisitions,quiet life hypothesis,the takeover market"
"ENVI,SOCI,BUSI,AGRI,ECON,DECI","Sustainable consumer behavior,Sustainable consumption,Sustainable local food systems,Urban-rural"
"ENVI,SOCI,ENER,ENGI,COMP","alkali treatment,bagasse fiber,coconut husk,natural fiber reinforced composites,natural fibers,thermogravimetric analysis; battery degradation,electric vehicle charging,photovoltaics,second-life battery,techno-economic analysis; biodiesel,energy consumption,oil palm cultivation,technology adoption,Thailand; bus transportation,GPS data analytics,quality of service,smart city,smart mobility,urban informatics; renovation,space management,vacant houses,wooden buildings"
"ENVI,SOCI,ENGI,DECI","Bike-sharing,Built environment,Meta-analysis,Rail-transport"
HEAL,"Alanine dosimeter,output measurement,radiotherapy; Brain template,image registration,probabilistic tractography; Cobb angle,Dowager's hump,radiology,Round back,spine; Exercise,neck pain,scapula; Manual therapy,Mechanical neck pain,Spinal manipulation,Spinal manipulative therapy,Spinal mobilization; abdomen CT imaging,detectability index,dual-energy CT imaging,hepatic lesion detectability,Low tube potential single energy CT,task-based image quality assessment,virtual monochromatic image; ancestry assessment,femur,forensic anthropology,Forensic science,platymeric index,subtrochanteric shape,Thai skeleton; antioxidant activity,Neurite outgrowth,neuroprotective effect,safflower (Carthamus tinctorius L.),sea holly (Acanthus ebracteatus Vahl.),toothbrush tree (Streblus asper Lour.); classifier,HCC screening,liver ultrasound,two-stage model,YOLOv4 detector; counter movement jump,fatigue sensation,maximal voluntary contraction,neuromuscular fatigue,trail running"
"HEAL,AGRI,IMMU,SOCI","adipocyte,AKT/GSK3β,AMPK-ACC,Boesenbergia rotunda,fingerroot,isopanduratin A,MAPKs,MCE,obesity; adipocyte,fatty acid synthase,glycerol,HDOCK,lipolysis,liposome,nanoparticles,orlistat; anthocyanins,antioxidant activity,purple corn milk,refrigerated storage,sensory acceptance,shelf-life,thermal processes; anti-inflammatory,antioxidant,cell signaling pathways,chitooligosaccharide,macrophage cells,shrimp shell; antimicrobial activity,antioxidant,bioassay-guided isolation,natural food packaging,natural preservative,phenolics; apoptosis,Brassica,cancer,glucosinolate,isothiocyanate,kale,leukemia; bacteriocin,cold storage,fruit juice,hurdle concept,microorganisms,quality; bioactive compound,ergosterol,food chemistry,nutraceutical,nutrition; bioactive compounds,cocoa shell powder,functional foods,microencapsulation,ultrasonic extraction; coffee oil,defective coffee beans,response surface methodology,supercritical fluid extraction,volatile aroma components; enzyme,fermented coffee,Lactiplantibacillus plantarum,Paenibacillus motobuensis"
"HEAL,BIOC","Alginate,Chitosan,Iron oxide nanoparticles,Magnetic targeting delivery,Stimuli-responsive"
IMMU,"Actinomycetes,Antibiotics,Biocontrol agents,Enzymes,Plant growth promotion; Bacillus,Plant growth-promoting rhizobacteria (PGPR),Plant roots,Rhizosphere,Spore-forming bacteria; Bacterial community,Plant growth-promoting rhizobacteria,Proteobacteria,Rhizosphere,Root exudate; Chromid,Genomic background,Multipartite genome,Nitrogen fixation,Nodulation,Pangenome,Symbiosis,Whole-genome; Circadian clock,Cyanobacteria,Halotolerance,Omics analysis,Osmoprotectant,Signal transduction,Sodium extrusion; Diversity,Plant growth promoting,Rhizosphere,Yeast; Metagenomics,Microbial community,Plant disease control,Plant immune,Rhizosphere microbiome; Plant-microbe interaction,Rhizosphere,Root exudate,Volatile organic compound; aging,comorbidities,COVID-19,hepatic diseases,HIV,prevention,treatment,tuberculosis; antiretroviral therapy,CD8 T cells,cell differentiation,HIV,HIV reservoir; defined microbial starter,melanogenesis inhibition,rice-based fermented product; endophytic bacteria,genome analysis,indole-3-acetic acid,plant growth-promotion,Sphingobium"
"IMMU,BIOC","16S rRNA gene,Actinomycete,Hot spring soil,Micromonospora,Whole-genome analysis; 16S rRNA gene,Actinomycetes,Antioxidant,Streptomyces,Whole-genome analysis; Acetic acid,Acid-tolerant yeasts,Lactic acid,Propionic acid,Schizosaccharomyces pombe,Schwanniomyces etchellsii; Alarmin,Allergen,HDM,Innate sensor,Lipid-binding protein,Protease; Animal models,Biofilms,COVID-19,Endotracheal tube,Silver nanoparticles,Ventilator-associated pneumonia; Antitumor,Immuno-oncology,Immunomodulators,Nivolumab,PD-1,Programmed cell death,Protein therapeutics; COVID-19,Diagnostic reagents,Plant-produced ACE2 protein,SARS-CoV-2,Surrogate virus neutralization; COVID-19,Plant-produced subunit vaccine,Protective immunity, Hamster challenge,Receptor binding domain,SARS-CoV-2; Cannabinoids,chloroplast transformation,heterologous expression,microalgae,nuclear transformation,synthetic biology; Carbohydrate,Cyanobacteria,Gene regulation,Metabolism,Nitrogen; Cholesterol-lowering,Fermented mussel,Immunomodulation,Lactiplantibacillus plantarum,Probiogenomic,Probiotics; Cyanobacteria,Gene expression,Genomic adaptation,Glycine betaine,Halotolerance,Mycosporine-2-glycine,Osmoprotectant,Osmotolerance,Regulatory networks; Fructooligosaccharide,Fructosyltransferase,Prebiotic,Protein engineering"
"IMMU,PHAR","Category III exposure,Favipiravir,Post-exposure prophylaxis,Rabies immunoglobulin,Rabies virus"
"MATE,COMP,CHEM","ADMET,Anti-fungal,Lanosterol 14-alpha demethylase,Molecular docking analysis,Molecular dynamics simulation; Arrhenius law,Computer simulation,Enthalpy of adsorption,Henry coefficient,Monte Carlo simulation,Selective adsorption; DFT calculations,Ethylene polymerization,FI catalyst,Mechanism,Nickel; Molecular docking,Molecular dynamics,ORF3a,SAR-CoV-2,Spermidine"
"MATE,COMP,ENGI","Building,Built environment,Concrete,Construction,Environment,Microplastic,Pollution,Polymer,Waste"
"MATE,ENER","Model predictive control (MPC),Polylactic acid (PLA),Polymerization"
"MATE,ENER,CHEM","Acid sites control,Biomass,Brønsted acid,HMF,Lewis acid,Mesoporous silica; CO2 reduction,Electrocatalyst,nano porous,Tin"
"MATE,ENER,ENGI","Fast ion,Lorentz orbit code,Neutral beam injection,Thailand -1"
"MATE,ENVI","Anti-inflammatory,Antibacterial,Antioxidant,Eucalyptus camaldulensis,Hemostasis,Hypromellose composite; Antibacterial wound dressing,Curcumin,Mangosteen,Natural extracts,Polyurethane foam; Cannabidiol,Cyclodextrin inclusion complex,Poly(vinyl alcohol),Semi-solid hydrogel,Wound management; Cerium (IV) sulfate,dehydration,isosorbide,sorbitol"
"MATE,MATH,COMP,ENGI","CO2 emission,energy consumption,GMDH,intelligent techniques,MLP"
"MATE,MATH,ENGI","Couple stress elasticity,elastic substrate,Gurtin–Murdoch surface elasticity,material length scales,size-dependent behavior; classical shell theory,FGP-GPLRC,Free vibration,Rayleigh-Ritz method,simple FSDT,spherical shell segments; different boundary conditions,FGP sandwich,first-order shear deformation shell theory,Free vibration,Rayleigh-Ritz method,rotating cylindrical shell"
"MATE,PHYS","Actuator,Biopolymer blend,Electroactive material,Poly(butylene succinate-co-butylene adipate),Poly(o-phenylenediamine); Al anodization,factorial design,niobium pentoxide,photocatalysis,plasma electrolytic oxidation,porous oxide coatings; Carrageenan,Electrically controlled release,Freeze-drying,Transdermal patch; DFT method,Nonmetallic impurities segregation,γ-Fe,Σ5 (310) grain boundary; First principles,Gas adsorption,Gas sensors,Heterojunction,Selectivity; aggregation,cyclodextrins,microparticles,nanoparticles,properties,supersaturated solutions; carbon fibers,solution plasma,solution plasma-generated seeds,soot; conventional superconductivity,electron-phonon coupling,Eliashberg-Migdal formalism,positive hydrostatic pressure,spin-orbit coupling; corrosion resistance,direct metal laser sintering,haynes 282 nickel superalloy,ion nitriding,microstructure,tensile test"
"MATE,PHYS,CHEM","Antibiotic removal,BEA-type zeolites,Dry-gel conversion,Magnetic zeolite,Sulfadiazine; Bio-imaging,Colorimetric,Cu2+ ions,Fingerprint,Fluorimetric,Imidazole,Low-LOD,Paper-strip; Bio-imaging,DFT calculations,LOD,Pharmaceutical samples,Ratiometric,Solvatochromism; Conductivity,Dissociation,Infinite dilution,Ionic liquids,Kirkwood–Buff theory,Molecular dynamics; biomaterials,Chromolaena odorata (Siam weed),Gelatin hydrogel,wound care,wound healing materials; cathodes,H3.78V6O13,reaction mechanisms,X-ray absorption spectroscopy,zinc-ion batteries"
"MATE,PHYS,COMP,ENGI","analytical sensing,antibacterial,consumable products,food preservations,green synthesis,nanoparticles"
"MATE,PHYS,ENER,CHEM","Drug,Electrolyte Components,Screen-Printed Graphene Electrode,Serum,Sulfasalazine,Urine"
"MATE,PHYS,MATH,ENGI","Anisotropic materials,Near-interface cracks,Stress intensity factors,T-stresses,Weakly singular boundary integral equations"
"MATE,PHYS,MEDI","3D printed phantoms,CT assessment,detectability,model observer; detectability,dose efficiency,high resolution,photon counting CT"
MATH,"(k, ψ)-Hilfer fractional derivative,fixed-point theorems,impulsive conditions,nonlocal conditions,Ulam stability; 11M26,11M41,11R42,2020 Mathematics subject classification; Bonus-malus system,Discrete-time risk model,Finite-time ruin,Parisian ruin,Recursive computation,Surplus-dependent premiums; Call function,collateralized debt obligation (CDO),local dependence,Poisson approximation,Stein-Chen’s method; Characteristic function,Lattice random variable,Local limit theorem,Normal density function,Rate of convergence; Continued fraction,Ramanujan Machine,Second order linear recurrence with variable coefficient; Convex Configuration,Convex Polygon,Vertex-norm; ENR,HDPE,PBAT,PLA,Polymer blending; Equilibrium point,Periodic solution,System of piecewise linear difference equation; Extinction,Non-autonomous SIRS model,Number of hospital beds,Permanence,Threshold parameters; Independence Test,Nonuniform bound,Quadratic forms,Stein’s method,Unbounded Exchangeable Pair; Integer-valued polynomial,localization,polynomial over finite field,prime; Local limit theorem,normal density function,rate of convergence,weighted sums of Bernoulli random variable; choice-based conjoint analysis,Customer preference,discrete choice experiment,kano model,latent class analysis; definable group,definable module,definable ring,manifold topology,o-minimality; hazard function,maximum likelihood estimation,Maxwell generalized family,model selection criteria,quantile function; invariant transformation semigroups,regularity,Transformation semigroups"
"MATH,COMP","Artificial intelligence,Cognitive control,Divergent thinking,Executive function,Frontal lobes,Human-computer interaction,Intelligence,Neuroscience; CatBoost,Demand Forecasting,Inventory Management,Machine Learning,Product Inventory,Retail Store; Computational Electromagnetics,Dipole Antenna Array,Electromagnetic Field Pattern,Fourier Neural Operator; Consent management,Data protection,Event-B,GDPR,Privacy by design,Smart contracts; Design thinking,Futuristic design,Human-centered design; Fuzzy,Healthcare,Machine learning,Soft computing; coupler,finite element method,interference,photonics,stress,temperature"
"MATH,COMP,ENGI","3D dental analysis,cephalometric analysis,CT,landmark,landmark detection; Actuation and joint mechanisms,mechanism design,prosthetics and exoskeletons; Aerial systems: mechanics and control,nonlinear PID controller,optimal thrust force allocation,UAV design; COVID-19,machine learning,remote patient monitoring; Cardioembolic stroke,deep learning,multimodal fusion,non-contrast CT; Co-design,Embedded,FPGAs,Hardware acceleration,Image processing,Language,Paradigm; Convex optimization,Multi-input multi-output linear system,Multi-objective criteria,Q-parameterization,Time-domain performance,Two-stage compensators; Generative adversarial networks,Image segmentation,RoI-Based Attention Mechanism,Skin cancer; actuators,electromagnetic brake,friction mechanism,variable physical damping; artificial stiffness control strategy,gait rehabilitation,knee exoskeleton,knee reinforcement device,machine learning; differential driving,exoskeletons,sit-to-stand motion,wheelchair; nonlinear observer,PID control,pneumatic gripper,robot,soft gripper,soft material,unknown input observer; photoplethysmography (PPG),polysomnography (PSG),sleep monitoring,system integration,wearable sensors"
"MATH,DECI","Asian FX rates,Bayesian computation,Markov Chain Monte Carlo (MCMC),Stochastic Volatility (SV) model; Collective risk model,Compound binomial distribution,Compound negative binomial distribution,Compound Poisson distribution,Individual risk model,Local limit theorem; bargaining,exchange networks,games on graphs,stochastic matching"
"MATH,EART,ENGI","cadastral surveys,GNSS,IMU,MEMS,RTK"
"MATH,ENER,COMP","16-PSK,Free Space Optical Communication,OFDM,Rain and Cloud Attenuation"
"MATH,ENER,COMP,DECI","-distributed energy resources,distribution grid planning,generative adversarial network,scenario generation"
"MATH,ENER,ENGI","DC optimizer,fixed effect,microinverter,mixed-effects model (MEM),partial shading conditions (PSC),random effect; acid mine drainage,coal,jig,microencapsulation,pyrite; biomass,calcium looping,co-gasification,CO2 emission,coal; circular economy,disposable bamboo chopsticks (DBCs),soil supplementary,urban waste upcycling,wooden biochar; diffusion of innovations,innovativeness,intention,prosumer,renewable energy,residential solar photovoltaics,RPV adoption,Thailand,theory of planned behavior,TPB; economy of scale,off-grid electrification,solar PV,techno-economic analysis; high voltage direct current,ion flow field,numerical method,shielding conductor,transmission lines,upwind finite volume method,wind"
"MATH,ENGI","Anisotropic materials,BIEMs,Crack-face displacement,Cracks,T-stresses,Weakly singular integrals; Antagonistic variable stiffness actuator,Input-delay compensation,Prediction-based control,Super-twisting sliding mode control; adaptive controller,anomaly detection,bond graph,digital twins,motion control,trajectory following controller; bidirectional (BD) material distributions,buckling,elastic foundations,finite element formulations,functionally graded piezoelectric porous (FGPP) plate,Thermoelectric loading,vibration; delayed tri-trophic food chain model,fear effect,Hopf bifurcation,stability analysis,supplying additional food; gradient-free proportional topology optimization,isogeometric analysis,multiresolution,reconstruction with NURBS basis functions"
"MATH,ENVI,CHEM,MATE,BIOC,AGRI,ENER","Fibonacci Number,Linear Recursion,Recurrence relation"
"MATH,MULT","active-site model,density functional theory,high-entropy alloy,host-element impact; computational catalysis,heterogeneous catalyst screening,multi-element alloys,supervised gaussian process regression"
"MATH,PSYC,ARTS","explanatory power,mean and covariance structure model,principal component regression,standard error estimate"
"MATH,SOCI","automatic item generation,force and laws of motion,item model,misconception"
"MEDI,AGRI","Abiotic stress,Drought stress,Mass spectrometry,Medicinal plants,Metal stress,Proteomics,Salt stress,Temperature stress,UV stress; Apis,chito-oligosaccharide,Nosema ceranae,propolis; antifungal susceptibility,cats,genotypic characterization,phenotypic characterization,Sporothrix schenckii,sporotrichosis"
"MEDI,AGRI,IMMU","Anaplasma marginale,Cattle,Genetic characterization,Genotyping,Major surface protein gene,Thailand"
"MEDI,AGRI,IMMU,BIOC","Genetic diversity,Horse,Phylogenetic analysis,Setaria digitata,Thailand"
"MEDI,AGRI,PHAR","Immune cell activation,Marine invertebrate,Neuron apoptosis,Neuronal injury,Protein plaque,α-synuclein; amides,antimicrobial,antioxidant,aristolactams,cytotoxicity,Piper wallichii"
"MEDI,CHEM,ENVI","Agriculture suitability index,Anthropogenic activities,Cleaner water supply system,Nitrate contamination,Radial basic function; Alloys,Carbon nanotubes,Hydrogen evolution reaction,Hydrogen generation,Nickel palladium,Waste plastics; Arsenic,Coastal aquifer,Groundwater drinking,Health risk assessment,Thailand,Urine sample; Bacterial co-occurrence,Bacterial community shifts,Bacterial consortia,Marine sediment,Phthalate ester; Bioremediation,Crude oil-contaminated seawater,Immobilized bacterial consortium,Oil spill,Whole genome analysis; Biowaste to energy nexus,Development of bioreactors,Microbial fuel cells,Potential microbes; Bismuth oxybromide,Noble metals,Phenol,Plasmonic effect,Visible light; Cadmium contamination,Food safety,Magnet-assisted soil washing,Soil remediation,Zero-valent iron; Ce doped ZnO,Electrode,LPG gas Sensing,Nanomaterials,PET thin Films; Coking,Cyclic coke,Density functional theory,Phase transformation,γ-Al2O3"
"MEDI,CHEM,PHAR","Antibacterial,Dimeric xanthone,Enzyme inhibitory,Lichen,Usnea baileyi,α-Glucosidase; Curcuma,Essential oil composition,Gas chromatography–mass spectrometry,Headspace solid-phase microextraction"
"MEDI,COMP","Deep learning,Gastric intestinal metaplasia,Real-time semantic segmentation; Image classification,Mitotic count,Multi-stage deep learning,Object detection,Whole slide image"
"MEDI,ENGI","agreement,glaucoma,OCTA,optic neuropathy,peripapillary; diabetic nephropathy,diabetic retinopathy,optical coherence tomography angiography,urine albumin,vessel density"
"MEDI,ENVI","Arsenic,Groundwater contamination,Groundwater risk assessment,Machine learning,Spatial probability model,Thailand; Chinese archery,core executive function,mind-body unit,preadolescent children; Kazakhstan,radon,thoron; carbonaceous species,EPFRs,hydroxyl radicals,oxidative potential,risk assessment; communication intervention,discrimination,high-school students,stigma,tuberculosis; female farmworkers,pesticide exposure,pesticide training program; health awareness,perceived policy effectiveness,physical activity,working women"
"MEDI,ENVI,PHAR","Analysis method,COVID-19,Degradation,Human health,Microplastics"
"MEDI,HEAL","ADR,De-labeling,Drug allergy,Multidisciplinary; Abdomen,ASIR,Computed tomography,Deep learning image reconstruction; Adrenal cortex hormones steroids,Magnetic resonance imaging,Pain,Platelet-rich plasma,Tendinopathy; Amputation,Meta-analysis,Rehabilitation,Removable rigid dressing,Rigid dressing; Anismus,Constipation,Dyssynergic defecation,MR defecography; Bilateral flatfoot,Foot exercise,Hip exercise,Medial longitudinal arch,Navicular drop; Coronavirus,COVID-19,Drug-related problems,Home isolation,Pharmaceutical care,Pharmacists,Telepharmacy; Diabetic foot osteomyelitis,Diabetic foot ulcer,Risk factor; Health knowledge, attitudes, practice,In-depth interview,Levonorgestrel,Postcoital contraception,Surveys and questionnaires; caffeine,creatine,isocaloric supplement,soccer performance,sports drink,sprinting time; hyperparathyroidism,parathyroid scintigraphy,radionuclide imaging; mild cognitive impairment,Older adults,reliability,sit-to-stand,validity"
"MEDI,HEAL,ENGI","Cannabis,Legislation,Sentiment Analysis,Social Media,Thailand"
"MEDI,IMMU,BIOC","Alcohol,endotoxin,FcγRIIb-deficient mice,leaky gut,systemic lupus erythematosus; CD19,Chimeric antigen receptor T cells,Fetal bovine serum,Human AB serum,PiggyBac transposon,Serum replacement reagent; booster,ChAdOx1 nCoV-19,COVID-19,durability,immunogenicity,neutralizing antibodies,SARS-CoV-2; canine distemper virus,CDV,leopard,Panthera pardus,Panthera tigris,serology,serum neutralization test,tiger"
"MEDI,IMMU,ENVI,BIOC","antibiotic free,cecum,gut microbiota,gut resistome,metaproteomics,pig; blockade of binding,dengue virus,ELISA,neutralizing antibody; fermentation,fermented black rice,melanogenesis inhibition,metatranscriptomics,starter"
"MEDI,IMMU,PHAR","AMR,antibiotic,antimicrobial resistance,Stenotrophomonas maltophilia; ANCA-associated pauci-immune glomerulonephritis,ANCA-associated vasculitis,COVID-19 vaccine,SARS-CoV-2 vaccination; Acute lung injury,Aporphine alkaloid,Lung inflammation,Oxocrebanine,Stephania pierrei; COVID-19 vaccine,heterologous,homologous,intradermal (ID),intramuscular (IM),severe acute respiratory virus 2 (SARS-CoV-2),spike 1 specific immunoglobulin A (anti-S1 IgA); COVID-19,immunogenicity,radiotherapy,SARS-CoV-2,vaccination; Galectin-3,Knee osteoarthritis,Phosphatidylinositol-3-kinase/Akt pathway,Synovial inflammation; acute kidney injury,inactivated SARS-CoV-2 virus vaccination,membranous nephropathy,nephrotic syndrome; adolescent,child,immunization program,Pediatric,switch,systematic review,vaccine; adverse events,BNT162b2,COVID-19 vaccines,myocarditis,pericarditis; adverse events,BNT162b2,booster COVID-19 vaccine,cancer patients,ChAdOx1,CoronaVac,malignancy,mRNA-1273,safety; anti-RBD,booster,COVID-19,humoral immunity,infection,SARS-CoV-2,vaccine; anti-SARS-CoV-2 IgG,BNT162b2,COVID-19,Delta,hybrid immunity,long COVID in children,neutralizing antibody titer,Omicron,post COVID-19 conditions,SARS-CoV-2 infection; aquaculture,Asian seabass,bacterin,ELISA,formalin-killed vaccine,qPCR,streptococcosis; booster dose,immunogenicity,mRNA vaccine,Omicron,safety,severe acute respiratory virus 2 (SARS-CoV-2); controlling transmission,COVAX,COVID-19 vaccine lessons,disease X and pathogen X,epidemic and pandemic prevention,low- and middle-income country (LMIC) vaccine innovation and manufacture,modular vaccine production,mucosal immunity,pan-coronavirus vaccines,platform technologies (esp. inactivated viruses; recombinant proteins; viral vectors; mRNA),public investments and subsidies,R&D blueprints,regulatory challenges,technology global commons and global public goods,vaccine access,vaccine business model and value proposition,vaccine intellectual property (IP) and know-how transfer,vaccine prototypes,variants and booster strategies; cost-effectiveness analysis,disparity,economic evaluation,equity,immunization,inequality,vaccine; monoclonal antibody,Nicotiana benthamiana,plant produced antibody cocktail,post-exposure prophylaxis,rabies virus; mucosal immunity,nanoparticles,Oreochromissp,tilapia,vaccination"
